{
  "schema_version": "2.0",
  "event_id": "WPSR-2026-10-07",
  "mode": "live",
  "status": "scheduled",
  "report": "WPSR",
  "instrument": "CRUDEOIL",
  "release": {
    "date": "2026-10-07",
    "week_ending": "2026-10-02",
    "scheduled_utc": "2026-10-07T14:30:00Z"
  },
  "metrics": [
    { "id": "crude_stocks_change", "unit": "mb", "role": "trigger", "actual": null, "previous": 0.922, "consensus": [] },
    { "id": "gasoline_stocks_change", "unit": "mb", "role": "flag", "actual": null, "previous": -1.684, "consensus": [] },
    { "id": "distillate_stocks_change", "unit": "mb", "role": "flag", "actual": null, "previous": -2.251, "consensus": [] },
    { "id": "api_crude_change", "unit": "mb", "role": "context", "actual": -2.09, "previous": 1.019, "consensus": [] }
  ],
  "levels": {
    "contract_symbol": "MCX:CRUDEOIL1!",
    "prev_day": { "date": "2026-10-06", "high": 8694, "low": 8388, "close": 8634, "volume": 60489, "volume_ok": true },
    "pivots": { "type": "floor", "P": 8572, "R1": 8756, "R2": 8878, "R3": 9062, "S1": 8450, "S2": 8266, "S3": 8144 },
    "opening_range": null
  },
  "config": {
    "strategy_version": "spec-2026-10-07", "entry_style": "B1", "timeframe_min": 5, "pivot_type": "floor",
    "stop_rule": "S1", "stop_trigger": "touch", "exit_design": "E1", "target_rule": "pivot", "time_stop_min": 90, "min_reward_to_risk": 1
  },
  "data_quality": { "flags": [], "notes": "" },
  "provenance": {
    "created_at": "2026-10-07T08:00:00Z",
    "updated_at": "2026-10-07T08:00:00Z",
    "sources": ["data/mcx/crudeoil_daily.csv"]
  },
  "notes": "Example of a live record before the release: previous-day levels known, consensus and actuals empty. At T-5 min fill consensus (status pre_release); after the print fill actuals and bias (released); after 90 minutes fill signal, trade and outcome (closed)."
}
